{
  "schema_version": "0.1",
  "proposal_id": "proposal.unknown-server-001",
  "server_id": "mcp.unknown",
  "tool_name": "browser_read",
  "arguments": {},
  "principal": {
    "actor_id": "human.operations-owner",
    "authentication": {
      "trust_boundary_id": "identity.reference",
      "assertion_id": "assertion.unknown-server-001",
      "authenticated_at": "2026-08-21T19:55:00Z",
      "expires_at": "2026-08-21T20:55:00Z"
    }
  },
  "actor_id": "agent.researcher",
  "authorized_goal_id": "goal.support-research-001",
  "requested_at": "2026-08-21T20:00:00Z"
}
